{
  "$schema": "../../../../schemas/care-profile.schema.json",
  "id": "koalapet.base:fast_test_care",
  "display_name_key": "care.fast_test.name",
  "profile_kind": "fast_test",
  "hatch_duration_seconds": 5,
  "offline_cap_seconds": 172800,
  "satiety_decay_per_hour": 1600,
  "energy_use_per_hour": 900,
  "sleep_recovery_per_hour": 3000,
  "hygiene_decay_per_hour": 800,
  "weight_min_grams": 250,
  "weight_max_grams": 800,
  "meal_satiety_bps": 4500,
  "treat_satiety_bps": 2200,
  "meal_mood_bps": 600,
  "treat_mood_bps": 1000,
  "meal_weight_grams": 10,
  "treat_weight_grams": 4,
  "fullness_cap_bps": 10000,
  "digestion_seconds": 120,
  "max_waste_units": 3,
  "waste_hygiene_loss_per_hour": 1100,
  "hunger_call_threshold_bps": 4000,
  "tired_call_threshold_bps": 3000,
  "hygiene_call_threshold_bps": 4500,
  "sickness_call_threshold_bps": 5000,
  "call_response_seconds": 1800,
  "severe_hunger_threshold_bps": 1200,
  "illness_dirt_seconds": 1800,
  "illness_hunger_seconds": 3600,
  "illness_probability_bps": 1200,
  "sleep_energy_threshold_bps": 2600,
  "wake_energy_threshold_bps": 8500,
  "sleep_disturbance_bps": 500,
  "training_energy_cost_bps": 1200,
  "training_effort_gain_bps": 700,
  "training_mood_gain_bps": 450
}
